,Detector,Explainer,Documents Phases 1+3,Documents Phases 2+4,f(a),f(b),GT a,GT b,idx a,idx b,Spacy Similarity,Jaccard Similarity,Cosine Similarity tfidf,hash a,hash b
15,DetectorDetectGPT,SHAP_Explainer,"It is possible that stress could be contributing to some of the symptoms you are experiencing, such as headaches and possibly even the leg pain. However, it is important to note that the other symptoms you mentioned, such as night sweats, bleeding gums, bloating, a sudden bruise, and a red pinprick on your arm, could potentially be caused by other underlying medical conditions. It is always a good idea to speak with a healthcare professional if you are experiencing any concerning symptoms, so that they can properly assess your health and provide an appropriate course of treatment. It is especially important to seek medical attention if you have any unexplained bruises or red pinpricks on your skin, as these could potentially be signs of an underlying medical issue.","If your deductions are higher than your income, it is possible that you may not owe any taxes. This can happen if you have a loss for the tax year, which can be calculated by subtracting your deductions from your income. If the result is a negative number, then you have a loss for the tax year.However, it's important to note that losses from some types of income, such as wages, salaries, and self-employment income, may be limited in the amount that can be claimed on your tax return. Additionally, you may be able to carry over any excess loss to future tax years and use it to offset income in those years.It's a good idea to consult with a tax professional or refer to the Internal Revenue Service (IRS) guidelines to determine how to properly report and claim losses on your tax return.",0,0,False,False,72,77,0.9474488830880534,0.23776223776223776,0.18438548083213213,2896cd03f5a9e20c7aabbc57edfa78908bc88025779a184ba1793badb684dba7_SHAP_Explainer_DetectorDetectGPT,4a28a8f0d8c6fbee4a7aad31697d315f2e4782776460940f74505a777beeea7e_SHAP_Explainer_DetectorDetectGPT
16,DetectorDetectGPT,SHAP_Explainer,"Alonzo Church (June 14, 1903 – August 11, 1995) was an American mathematician, computer scientist, logician, philosopher, professor and editor who made major contributions to mathematical logic and the foundations of theoretical computer science. He is best known for the lambda calculus, the Church–Turing thesis, proving the unsolvability of the Entscheidungsproblem, the Frege–Church ontology, and the Church–Rosser theorem. He also worked on philosophy of language (see e.g. Church 1970). Alongside his student Alan Turing, Church is considered one of the founders of computer science.","Stock support and resistance levels are generally considered to be more meaningful on longer time scales, such as daily or weekly charts. This is because these levels tend to be more significant in terms of the overall trend and momentum of the stock, and can be more reliable indicators of potential turning points in the price.On shorter time scales, such as intraday charts, support and resistance levels can still be important, but they may be less reliable due to the increased volatility and noise in the market. It can be more difficult to identify clear support and resistance levels on these shorter time frames, and they may not hold as well as they do on longer time scales.In general, it's important to consider the overall trend and context of the market when evaluating support and resistance levels, as well as the specific time frame you are looking at.",0,0,True,False,140,267,0.7646954813375146,0.06474820143884892,0.04788419106875306,652189ac593cc7b3afcb7e0bd1c48f5b8209e21ca515947d7c216869dd2e9185_SHAP_Explainer_DetectorDetectGPT,a98eedec2f3faa2bedc5b48424bffa0fb467ad56d4bcb344ed309833ca80ab75_SHAP_Explainer_DetectorDetectGPT
17,DetectorDetectGPT,SHAP_Explainer,"AT&T Labs is the research & development division of AT&T, the telecommunications company. It employs some 1,800 people in various locations, including: Bedminster NJ; Middletown, NJ; Manhattan, NY; Warrenville, IL; Austin, TX; Dallas, TX; Atlanta, GA; San Francisco, CA; San Ramon, CA; and Redmond, WA. The main research division, made up of around 450 people, is based across the Bedminster, Middletown, San Francisco, and Manhattan locations.
AT&T Labs traces its history from AT&T Bell Labs. Much research is in areas traditionally associated with networks and systems, ranging from the physics of optical transmission to foundational topics in computing and communications. Other research areas address the technical challenges of large operational networks and the resulting large data sets.","Automated decision-making (ADM) involves the use of data, machines and algorithms to make decisions in a range of contexts, including public administration, business, health, education, law, employment, transport, media and entertainment, with varying degrees of human oversight or intervention. ADM involves large-scale data from a range of sources, such as databases, text, social media, sensors, images or speech, that is processed using various technologies including computer software, algorithms, machine learning, natural language processing, artificial intelligence, augmented intelligence and robotics. The increasing use of automated decision-making systems (ADMS) across a range of contexts presents many benefits and challenges to human society requiring consideration of the technical, legal, ethical, societal, educational, economic and health consequences.",0,0,True,True,92,102,0.9194969144126878,0.12337662337662338,0.09016309176412392,419fe06a0a8966dddad1519cb2bca2a274c12f552c6461ab67a4a5e2c29f15e6_SHAP_Explainer_DetectorDetectGPT,a076837b4d14ff5dbce23f39055fe4e80396f0798946572536085c2d0b72db02_SHAP_Explainer_DetectorDetectGPT
18,DetectorRadford,Anchor_Explainer,"I've heard of handyman type people making a living this way untaxed.  They move into a fixer-upper, fix it up while living there, stay over two years and sell.  They can pocket $125k/yr tax free this way assuming they produce that much value in their fixing-up.  (Beware, though, that this will bite you in low social security payments in retirement!)","Both are saying essentially the same thing.  The Forbes articles says ""as much as 20% [...] up to a maximum of $50,000"".  This means the same as what the IRS page when it says the lesser of a percentage of your income or a total of $53,000.  In other words, the $53k is a cap: you can contribute a percentage of your earnings, but you can never contribute more than $53k, even if you make so much money that 20% of your earnings would be more than that. (The difference between 20% and 25% in the two sources appears to reflect a difference in contribution limits depending on whether you are making contributions for employees, or for yourself as a self-employed individual; see Publication 560.  The difference between $50k and $53k is due to the two pages being written in different years; the limits increase each year.)",1,1,True,True,0,52,0.8874951075616169,0.13513513513513514,0.0909054275804122,6a66e7a115420485acd54c0cb9e5dc4e9e508b29af4b544aee8ec3f9adfaf7ac_Anchor_Explainer_DetectorRadford,714b04dd8923e09ea3f370b93660441d792104140d13d38c697abcbe465d0e10_Anchor_Explainer_DetectorRadford
19,DetectorRadford,Anchor_Explainer,"Thanks for your question on Health Care Magic. I can understand your concern. Constant coughing is commonly seen in bronchitis and pneumonia. So better first rule out pneumonia. So get done chest x ray. If chest x ray is normal then no need to worry for pneumonia. Possibility of bronchitis is more in her case. And bronchitis needs Inhaled bronchodilators and inhaled corticosteroid (ICS). Duavent is having perfect combination of inhaled bronchodilators and ICS. So no harm in giving Duavent. And yes, temperature of 37.3 is normal. No need to worry for this. Hope I have solved your query. I will be happy to help you further. Wishing good health to your daughter. Thanks.","Thanks for your question on Health Care Magic. I can understand your concern. Usually veins are not appeared on breast tissue. But sometimes dilated, green coloured veins running on breast skin are seen in1. Viral skin infection of breast. 2. Breast tissue infection 3. Breast mass either benign or malignant. So better to consult doctor and get done clinical examination of breast, mammography, sonography of breast to rule out major breast diseases. If all these are normal then no need to worry much. Apply warm water pad on affected areas, you will be alright. Hope I have solved your query. I will be happy to help you further. Wish you good health. Thanks.",1,1,True,True,63,228,0.9584914268427907,0.34146341463414637,0.1918810964802487,477d8f805d1a6f0f573a60d6dee3dc0aad68fc4eb7ca59ced04cb6aa7cf261ac_Anchor_Explainer_DetectorRadford,5fc9975e05b6dfc33272bb4cdd836cc0824aa113aaa397bd09d0fb74cce31168_Anchor_Explainer_DetectorRadford
20,DetectorRadford,Anchor_Explainer,"In logic, mathematics and linguistics, And (



∧


{\displaystyle \wedge }

) is the truth-functional operator of logical conjunction; the and of a set of operands is true if and only if all of its operands are true. The logical connective that represents this operator is typically written as 



∧


{\displaystyle \wedge }

 or  ⋅ .




A
∧
B


{\displaystyle A\land B}

 is true if and only if 



A


{\displaystyle A}

 is true and 



B


{\displaystyle B}

 is true, otherwise it is false.
An operand of a conjunction is a conjunct.
Beyond logic, the term ""conjunction"" also refers to similar concepts in other fields:","A computer scientist is a person who is trained in the academic study of computer science.
Computer scientists typically work on the theoretical side of computation, as opposed to the hardware side on which computer engineers mainly focus (although there is overlap). Although computer scientists can also focus their work and research on specific areas (such as algorithm and data structure development and design, software engineering, information theory, database theory, computational complexity theory, numerical analysis, programming language theory, computer graphics, and computer vision), their foundation is the theoretical study of computing from which these other fields derive.
A primary goal of computer scientists is to develop or validate models, often mathematical, to describe the properties of computational systems (processors, programs, computers interacting with people, computers interacting with other computers, etc.) with an overall objective of discovering designs that yield useful benefits (faster, smaller, cheaper, more precise, etc.).",1,1,True,True,292,151,0.868203768638849,0.1282051282051282,0.05524623578877558,e116470db16aa791b7a7a11835cd9cf6e6335d3c33458397b0b86c6486359b12_Anchor_Explainer_DetectorRadford,48b3882e967ad4c711328e7fb10dbbb034283b1e003f7bbe7822d5808c64467d_Anchor_Explainer_DetectorRadford
21,DetectorRadford,Anchor_Explainer,"It is difficult to accurately diagnose a medical condition without examining a patient in person and obtaining a full medical history. However, there are a few possible explanations for the symptoms you have described.

One possibility is endometriosis, a condition in which tissue similar to the lining of the uterus (called the endometrium) grows outside the uterus, causing pain and sometimes fertility problems. Other possibilities could include ovarian cysts, uterine fibroids, or pelvic inflammatory disease (PID).

It is important to see a healthcare provider for a proper evaluation and diagnosis. They can perform a physical examination, order appropriate tests, and discuss treatment options with you. In the meantime, it may be helpful to keep a symptom diary to help you and your healthcare provider track the pattern and severity of your symptoms.","It is possible that the pain and other symptoms you are experiencing could be related to anxiety. Stress and anxiety can cause physical symptoms such as chest pain, rapid heartbeat, and muscle tension. However, it is also important to consider the possibility that these symptoms could be caused by other factors, such as an underlying health condition. It is always a good idea to have any new or unusual symptoms checked out by a healthcare professional to determine the cause and ensure that you receive proper treatment. If you are concerned about your symptoms, I would recommend speaking with a healthcare provider for a proper evaluation. They can help determine the cause of your symptoms and recommend appropriate treatment.",0,0,False,False,80,296,0.9614546023752516,0.2553191489361702,0.31259035092174986,2b591b40c2ea9a0aefe618acd99c2b499c7eb759592aaac6707fc9039bfedf07_Anchor_Explainer_DetectorRadford,b3ec68c74de53fc0c6fe8729beb8ae1840ff888e169d559297ce3addd5b59a7e_Anchor_Explainer_DetectorRadford
22,DetectorRadford,Anchor_Explainer,"Waldenstrom's macroglobulinemia is a type of lymphoma, a cancer of the immune system. It is characterized by the production of abnormal amounts of a protein called IgM (immunoglobulin M) in the blood. This can lead to a range of symptoms, including weakness, fatigue, and body aches.

It is possible that the body aches and other symptoms you are experiencing could be related to your Waldenstrom's macroglobulinemia. It is important to discuss any symptoms you are experiencing with your oncologist, as they may be able to suggest treatment options or referrals to other specialists who can help manage your symptoms.

It is also important to follow your treatment plan and attend regular check-ups with your oncologist to monitor the progression of your disease and to make any necessary adjustments to your treatment plan.","It is not uncommon for pain to increase after a cortisone injection. This can occur for a variety of reasons. For example, the injection may cause inflammation at the injection site, which can lead to increased pain. Additionally, the injection may temporarily increase blood flow to the area, which can cause swelling and discomfort. It is also possible that the pain is unrelated to the cortisone injection and is simply a coincidence.

If you are experiencing increased pain or difficulty breathing after the cortisone injection, it is important to contact your doctor. They can assess your symptoms and determine the cause of the pain. They may recommend medications or other treatments to help manage the pain. It is also important to follow your doctor's instructions for post-injection care, such as avoiding strenuous activity or applying ice to the injection site.",0,0,False,False,132,255,0.9833308166968809,0.24060150375939848,0.161283767587918,4f3d9b0506f8558d1e36d0c1dfa7ad6b17e57a1eff8400979e89e4c31ad646b1_Anchor_Explainer_DetectorRadford,60707fbb129a62fd3e3a762cb9a9c8d57a8781c4d65dda94e0bd84ae4b54910c_Anchor_Explainer_DetectorRadford
23,DetectorRadford,Anchor_Explainer,"It is not advisable to ignore tax obligations and start a new business to avoid paying taxes. This could be considered tax evasion, which is a serious offense that can result in criminal charges and significant penalties.Instead, you should try to come to a resolution with the tax authorities to pay the taxes that your company owes. You may be able to negotiate a payment plan or an offer in compromise to resolve the tax debt. Ignoring the problem is likely to make it worse, and could lead to legal action being taken against your company.It is important to seek the advice of a qualified tax professional to help you understand your options and determine the best course of action for your specific situation. They can help you negotiate with the tax authorities and find a solution that works for you and your business.","It is important to note that alternative medicine, such as homeopathy and ayurveda, should not be used as a replacement for conventional medical treatment for esophagus disorders. It is important to consult with a medical professional and follow their recommended treatment plan.

That being said, some people with esophagus disorders may find relief from symptoms with the use of alternative medicine in addition to conventional treatment. If you are interested in exploring the use of alternative medicine, it is important to discuss this with your doctor and make sure that it is safe and appropriate for your specific condition.

It is also important to note that the effectiveness of alternative medicine for esophagus disorders has not been widely studied and there is limited scientific evidence to support its use. Therefore, it is important to be cautious and to carefully consider the potential risks and benefits before trying any alternative treatments.",0,0,False,False,281,283,0.9510900325779242,0.17763157894736842,0.15331008998798132,8307ed3a452a1150d1768381ecba695ab7a0a857fdf66ce7b70795da408d1627_Anchor_Explainer_DetectorRadford,84534927d51051602ae5f88b2ae19eb988ea070fa35837ba68b9b85abef414e0_Anchor_Explainer_DetectorRadford
24,DetectorRadford,LIME_Explainer,"It's possible that the pain in your back is related to your bronchitis, although without more information it's difficult to say for sure. It's possible that the inflammation caused by the bronchitis is causing pain in the skin on your back. Alternatively, the pain could be due to a muscle strain or other unrelated issue.

To help relieve the pain, you could try taking over-the-counter pain medication, such as acetaminophen (Tylenol) or ibuprofen (Advil). Applying a warm compress to the affected area may also help. If the pain persists or becomes severe, you should consult your healthcare provider for further evaluation and treatment.

It's also important to continue taking your antibiotics as prescribed and to follow any other recommendations from your healthcare provider to help speed your recovery from bronchitis.","If a trendline or pattern breaks due to some bad news but then returns back, it could be an opportunity to buy if you believe the bad news was temporary and the trend or pattern will continue. However, it's important to carefully consider the situation and do your own analysis before making any investment decisions. It's also a good idea to diversify your portfolio and not to put too much of your investment capital into any one asset.",1,1,False,False,74,248,0.9421107207702323,0.16030534351145037,0.17732777062827604,344f46edfe91a144674da8ef3262a58698950066cae54834b61469a801f583b1_LIME_Explainer_DetectorRadford,436c7e65081fa1a6597579ee32d8b6a0d7f88f1a3d8af0db3a3ea96dfab10035_LIME_Explainer_DetectorRadford
25,DetectorRadford,LIME_Explainer,"It doesn't generally matter, and I'm not sure if it is in fact in use by the IRS other than for general statistics (like ""this year 20% of MFJ returns were with one spouse being a 'homemaker'""). They may be able to try and match the occupation and the general levels and types of income, but for self-employed there's a more precise and reliable field on Schedule C and for employees they don't really need to do this since everything is reported on W2 anyway. So I don't think they even bother or give a lot of value to such a metric. So yes, I'm joining the non-authoritative ""doesn't matter"" crowd.","Hello, Thanks for your query.This can occur due to constipation and the white thing could have a protective mucus coating. The contraction of the large bowel to expel this can give you the pain. There can be an internal problem like an ulcer or a mass contributing to this. If you continue to get the same problems, it will be better to consult an Gastro and for further investigations like colonoscopy to rule out an internal problem.I do hope that you have found something helpful and I will be glad to answer any further query.Take care",1,1,True,True,40,163,0.9288793517016144,0.10810810810810811,0.10830841073586557,5ae5387b74d5d39364702c87dfff6d52121b249c4e7e6b28e9d3684e67481016_LIME_Explainer_DetectorRadford,797c3e2456febfd1031497754c2da79b9b0cb00f770118509209354664a94d17_LIME_Explainer_DetectorRadford
26,DetectorRadford,LIME_Explainer,"TL;DR: The date they were granted.  (Usually, this follows both an offer and acceptance.) It's not uncommon for a new vesting clock to start when there's a new round of funding coming in, because the investors want to make sure the key people are going to be engaged and incentivized going forward from that point.  They don't lower their expectations for how long they want folks engaged based on the person having started earlier.  Non-institutional investors may have the same concerns as institutional investors here and use the same vesting strategy to address them. Primary recognition of the benefits from having had people start earlier or be there longer (so long as it correlates with having gotten more done) is embedded in the valuation (which affects how much founders' shares are diluted in the raise).","It is possible for cysts to develop in the liver, and the presence of multiple cysts in both lobes of the liver could be a serious condition depending on the size and number of the cysts, as well as any symptoms that may be present. Some common causes of liver cysts include congenital abnormalities (present at birth), infection, and trauma. However, it is important to note that not all liver cysts require treatment, and in some cases they may be benign (non-cancerous) and cause no symptoms.

It is important to speak with a healthcare professional about the specific details of your CT scan and any symptoms you may be experiencing. They will be able to provide you with more information about the nature and potential treatment of your liver cysts.",1,1,True,False,71,227,0.9632885174282868,0.15757575757575756,0.09577672865835724,da9b052c0d269c574dcea123c6cb2f9fd6c299427e64b2f1d8353d0574fc9445_LIME_Explainer_DetectorRadford,9eac8625f1ce76e3ab8a5f3aac8669a179e0abf5fff35cc822f89c3b4e431ae4_LIME_Explainer_DetectorRadford
27,DetectorRadford,LIME_Explainer,"The price of fuel in Australia, like in any other country, is determined by a variety of factors, including the cost of production, transportation, and distribution, as well as market demand and supply. Additionally, taxes and other government policies can also impact the price of fuel. It is difficult to say whether the current price of fuel in Australia is too high or not without more information about the specific market conditions and factors that are influencing it.","I'm not familiar with the term ""cake and underwear"" stocks. It's possible that this is a slang term used by some investors to refer to stocks that are considered to be essential or basic necessities, similar to how cake and underwear are essential items that people need on a regular basis. However, without more context it is difficult to say for certain what this term refers to. It's possible that it could be used to describe a variety of different types of stocks, depending on how it is being used.",0,0,False,False,47,125,0.8862626405374056,0.20202020202020202,0.1041827556241561,a7b3bdfabc7637684099747710ffcb3511ba513b324be215e8a17e7118f4ce2d_LIME_Explainer_DetectorRadford,3d19b3cac118bd0523a41e321108d01137a1f51436fde8b74c38a3690497b146_LIME_Explainer_DetectorRadford
28,DetectorRadford,LIME_Explainer,"Investing in stocks can be a good idea if you are able to accept the risks that come with it. Stocks can offer the potential for high returns, but they can also fluctuate in value, and you could lose money. Before you invest in stocks, it's important to do your research and understand the basics of the stock market. It's also important to have a long-term perspective and a diversified portfolio, which means investing in a variety of different stocks and asset classes rather than putting all of your money into one type of investment. It's also a good idea to consult with a financial advisor or professional before making any investment decisions.","Share owner services, also known as shareholder services or stock transfer services, are a set of administrative services that are provided to shareholders of a company. These services typically include managing the transfer of ownership of shares, processing dividend payments and stock splits, and maintaining records of share ownership. They may also include providing information to shareholders about the company, its financial performance, and corporate governance issues. The purpose of share owner services is to ensure that shareholders have a reliable and efficient way to manage their investments in the company and to provide them with the information and support they need to make informed decisions about their holdings.",0,0,False,False,196,272,0.9392346448238671,0.13533834586466165,0.10808874436486489,f022d78aadca7c71859f5ac0face8af6733d02c0e59b3731b90b918cd9eaae83_LIME_Explainer_DetectorRadford,3fe9da95aee2d9fb76a7f18840ca38645ba725f62686e480aa63ac84bb11ee7c_LIME_Explainer_DetectorRadford
