,Detector,Explainer,Documents Phases 1+3,Documents Phases 2+4,f(a),f(b),GT a,GT b,idx a,idx b,Spacy Similarity,Jaccard Similarity,Cosine Similarity tfidf,hash a,hash b
0,DetectorDetectGPT,Anchor_Explainer,"Like anything else, the price/value of gold is driven by supply and demand. Mining adds about 2% a year to the supply. Then the question is, will the demand in a given year rise by more or less than 2%. ON AVERAGE, the answer is ""more."" That may not be true in any given year, and was untrue for  whole DECADES of the 1980s and 1990s, when the price of gold fell steadily.  On the other hand, demand for gold has risen MUCH more than 2% a year in the 2000s, for reasons discussed by others. That is seen in the six-fold rise in price, from about $300 an ounce to $1800 an ounce over the past ten years.","The way I would use it is, every trade done by a broker has a client side and a street side.  The client side is for their brokerage account, and the street side is whoever they traded with Say, John Doe calls me at Charles Schwab and wants to buy 100 IBM.  I look at the market and decide that the best execution is on Arca.  I trade on Arca for the client.  Then, I book a client side trade into his account, and a street side trade against Arca.  If I myself was a dealer in IBM and executed against my inventory, the street side would basically be internal, booking a trade against my account.",1,1,True,True,41,203,0.8273130261196648,0.11278195488721804,0.061294913045527644,61e5376ff4746da16bf0659eaabebbf5037c7c69d552f5c90bdcdd36c2a12777_Anchor_Explainer_DetectorDetectGPT,7107855c70ca6021b3690796048a3da0067b5e6abf98d66f7afe1f3bc27d8604_Anchor_Explainer_DetectorDetectGPT
1,DetectorDetectGPT,Anchor_Explainer,"You'll likely see several more scary market events before your autumn years. Ahhh, everyone has an opinion on this so here is mine :) If you are constrained to picking canned mutual fund products then I would target something with decent yield for two points. The third is to keep some in cash for an 'event'.   I would say 65/35 at this point so invest 65% and have some liquidity for an 'opportunity'.  Because the next crisis is right around the corner. But stay invested.","No. Securities brokers/dealers in the United States are licensed to broker debt and equity in corporations. (There are additional, commodities licenses to broker derivatives.) $20 American Eagle coins, or any other type of physical currency or physical precious metals can be traded or brokered by anyone without a specific license (except maybe a sales tax registration). The only situation where a securities license would be required is if a legal entity is holding the coins and you deal/broker an interest in that legal entity. For example, dealing in SPDR Gold Shares or a similar structure holding either physical assets or the right to purchase those assets (like a commodity pool) would require a securities and/or commodities dealing license.",1,1,True,True,173,1,0.8028380879869105,0.08333333333333333,0.05648682358561253,7bd59b306ee4f86d66ea0c02c7c6ad2f0c42df557f3731c23d04e7c7042cd2ff_Anchor_Explainer_DetectorDetectGPT,fe43a432243c718cfa3fa2bae6294e8c9514f4d931d2b5bd08508f83509cc4d0_Anchor_Explainer_DetectorDetectGPT
2,DetectorDetectGPT,Anchor_Explainer,"Got any creative for a 10 year old’s birthday?It is not appropriate to discuss complex financial topics or tax strategies with a child. It is important to consider the age and maturity level of a child when deciding on appropriate activities or discussions. Children at the age of 10 may not have the necessary knowledge or understanding to fully grasp concepts such as S Corps, straddles, and income. It would be more appropriate to celebrate a 10 year old's birthday with age-appropriate activities and gifts.","Both are correct depending on what you are really trying to evaluate. If you only want to understand how that particular investment you were taking money in and out of did by itself than you would ignore the cash.  You might use this if you were thinking of replacing that particular investment with another but keeping the in/out strategy. If you want to understand how the whole investment strategy worked (both the in/out motion and the choice of investment) than you would definitely want to include the cash component as that is necessary for the strategy and would be your final return if you implemented that strategy. As a side note, neither IRR or CAGR are not great ways to judge investment strategies as they have some odd timing issues and they don't take into account risk.",1,1,False,True,12,277,0.9075265606654819,0.13768115942028986,0.07786728153276305,cba2fc2710696f28b3c9bda38caaff1013b835fdb2f8e5185a891beb729841ea_Anchor_Explainer_DetectorDetectGPT,edebbd11c843b985aa543b539f521ef0b87b05f2cffc95b465432b5f4d98379a_Anchor_Explainer_DetectorDetectGPT
3,DetectorDetectGPT,Anchor_Explainer,"It's not appropriate for me to provide specific medical advice or to comment on the treatment plan that your doctor has prescribed for you without knowing more about your individual case and medical history. It's important to follow the treatment plan recommended by your doctor, as they are the most qualified to provide you with the appropriate care. If you have any concerns about your treatment plan, it's important to discuss them with your doctor. They will be able to provide you with more information and help address any questions or concerns you may have.","It's possible that the pain in your back is related to your bronchitis, although without more information it's difficult to say for sure. It's possible that the inflammation caused by the bronchitis is causing pain in the skin on your back. Alternatively, the pain could be due to a muscle strain or other unrelated issue.

To help relieve the pain, you could try taking over-the-counter pain medication, such as acetaminophen (Tylenol) or ibuprofen (Advil). Applying a warm compress to the affected area may also help. If the pain persists or becomes severe, you should consult your healthcare provider for further evaluation and treatment.

It's also important to continue taking your antibiotics as prescribed and to follow any other recommendations from your healthcare provider to help speed your recovery from bronchitis.",0,0,False,False,64,74,0.9515848511987584,0.23140495867768596,0.2363525205312497,1c35a009e503d36bb2c4626ddfba2ae6b24be70146daec612eda12a884ba5bab_Anchor_Explainer_DetectorDetectGPT,344f46edfe91a144674da8ef3262a58698950066cae54834b61469a801f583b1_Anchor_Explainer_DetectorDetectGPT
4,DetectorDetectGPT,Anchor_Explainer,"A wart that is painful and has become dry and cracked can be a sign of a more serious issue. It is possible that the wart has become infected or that it is not a wart at all, but rather a different type of growth. It is important to have any unusual growth on your skin checked by a healthcare professional to determine the cause and appropriate treatment. They will be able to examine the growth and determine if it is a wart or something else, and recommend the appropriate course of treatment. It is not recommended to try to treat the growth at home, as this can potentially make the situation worse or lead to further complications.","It is possible to get your property taxes lowered, but the process and requirements for doing so vary depending on where you live. In general, you may be able to appeal your property tax assessment if you believe that the value of your property has been overestimated by the tax assessor. You can also seek a property tax exemption or credit if you meet certain eligibility requirements, such as being a senior citizen or a disabled veteran.To learn more about the process for lowering your property taxes, you should contact your local tax assessor's office or visit their website. They can provide you with information on the specific requirements and procedures for appealing your assessment or applying for an exemption or credit in your area. It may also be helpful to consult with a local attorney or tax professional for guidance on how to proceed.",0,0,False,False,55,236,0.9377427161815689,0.17985611510791366,0.0977072037096296,14f4d8d694bcb6c17a5e261e82a8455458d236bdaa6f08376a549e1b23368058_Anchor_Explainer_DetectorDetectGPT,5ca91e318a694d2b6a8f6754659c3288c40fe9d7f587789dfdf8b1858762d342_Anchor_Explainer_DetectorDetectGPT
5,DetectorDetectGPT,Anchor_Explainer,"You can receive all the Money in your Bank. By Problem if you mean whether it will raise any alarms at the Bank. Most likely yes, such kind of activity would trigger AML. Bank would flag this off to regulators and questions would be asked. If you are doing a Legitimate business, its not an issue. Maintain a proper record of the transaction and pay your taxes. As funds are large 80 K a month, it makes sense to seek to advice of a Laywer and CA to help you keep thing in order.","It appears so. I suppose you could try saying that you don't want to pay for it and won't have Internet installed, but that could be detrimental to your career. There is no law that says your company has to pay for your Internet unless you have some kind of contract with them that says you will. If anything, your best option might be to try to claim it is a business expense and deduct it on your taxes.",0,0,True,True,100,261,0.9171300942915765,0.14035087719298245,0.16406941498646252,24d5ad95c1e2717ba84af4c43ce69d1a5f8e291f22a73fb120e8b779f7916a5c_Anchor_Explainer_DetectorDetectGPT,8e094008ce5ef1735693efa741bfed0b3c2df276cd901be9489d39ff62dc2281_Anchor_Explainer_DetectorDetectGPT
6,DetectorDetectGPT,LIME_Explainer,"Exchange traded options are issued in a way that there is no counter party risk.  Consider, stocks and options are held in street name. So, for example, if I am short and you are long shares, no matter what happens on my end, your shares are yours.  To be complete, it's possible to enter into a direct deal, where you have a contract for some non-standard option, but that would be very rare for the average investor.","Traditionally options expired on the 3rd Wednesday of the months of Mar, Jun, Sep, Dec as this day was never a holiday. See IMM dates. However as option use exploded there were monthly and weekly options created on different schedules. The exchange will specify when its options expire in the contract.",1,1,True,True,34,172,0.8385251920896533,0.10679611650485436,0.15582518023750774,bc1ac544b523873961b9f7584e55d8d4cde629ea895fa1482a5cc33e124f357f_LIME_Explainer_DetectorDetectGPT,8e42aeed132b74f34fa79d2c96ed8a54104a343073a89f88c90ec5be10e76edf_LIME_Explainer_DetectorDetectGPT
7,DetectorDetectGPT,LIME_Explainer,You can't. Even as a technical trader you should know what events are coming up and be prepared. You can't prepare for everything but you should know when the earnings dates are. You should also pay attention to the market in general. Stocks also have personalities and you should get to know that personality.  Most important thing in trading is deciding when to get out before buying and stick to it when it goes against you. It is also one of the hardest things to do.,"Depends on how you measure liquidity.  There's papers out there that approach this very question. Measured in order book spreads for a consolidated $100m trade, I'd say the second biggest market is FX swaps, followed or par'd by the money market (government bonds). If you disallow OTC venues, it's most definitely exchange listed government bonds. If, however, you happen to think in terms of sheer volume per time, the most liquid market phase could be considered the NYSE closing auction, as you can move billions in a matter of minutes, or expressed in speed terms: several m$/s (million dollars per second). You should pick a definition and we can provide you with a more accurate list of candidates and actual data.",1,1,True,True,10,30,0.8843447091744091,0.13013698630136986,0.14690825816365935,a342eb9f18bd17d57a51ac8d2a82af3705f3761337de56e9573071f7e1e9f892_LIME_Explainer_DetectorDetectGPT,48ccd95896b29bef9ffd5a14addf3235e368318b8a7f664c71960f2ed9a65b78_LIME_Explainer_DetectorDetectGPT
8,DetectorDetectGPT,LIME_Explainer,"Limit books are managed by exchanges. If an order is not immediately filled, it is sent to the book.  From there, orders are generally executed on price-time-priority.  The one major exception is the precedence hide-not-slide orders have over earlier placed visible slidden limit orders since unslidden orders are treated like a modification/cancellation. To an exchange, a modification is the same as a cancellation since it charges no fees for placing or canceling orders, only for trades.  The timestamp is reset, and price-time-priority is applied in the same way, so if a modified order isn't immediately filled, it is sent back to the book to be filled in order of price-time-priority.","Reuters has a service you can subscribe to that will give you lots of Financial information that is not readily available in common feeds.  One of the things you can find is the listing/delist dates of stocks.  There are tools to build custom reports.  That would be a report you could write.  You can probably get the data for free through their rss feeds and on their website, but the custom reports is a paid feature. FWIW re-listing(listings that have been delisted but return to a status that they can be listed again) is pretty rare.  And I can not think of too many(any actually) penny stocks that have grown to be listed on a major exchange.",1,1,True,True,191,249,0.9436101925709053,0.13793103448275862,0.07229198246058599,cb18fc73b58feeb14211103bba236c3a96f4bc881f323cdb0cd9e410b973cfad_LIME_Explainer_DetectorDetectGPT,e6b72b7969bbad53385251e1baf30d9f72a75067fc1707a1655fa38321f33f16_LIME_Explainer_DetectorDetectGPT
9,DetectorDetectGPT,LIME_Explainer,"Multivariate statistics is a branch of statistics that deals with the study of multiple variables and their relationships. In contrast to univariate statistics, which focuses on analyzing one variable at a time, multivariate statistics enables you to analyze the relationships among multiple variables simultaneously.



Multivariate statistics can be used to perform a variety of statistical analyses, including regression, classification, and cluster analysis. It is commonly used in fields such as psychology, economics, and marketing, where there are often multiple variables of interest.



Examples of multivariate statistical techniques include principal component analysis, multivariate regression, and multivariate ANOVA. These techniques can be used to understand complex relationships among multiple variables and to make predictions about future outcomes based on those relationships.



Overall, multivariate statistics is a powerful tool for understanding and analyzing data when there are multiple variables of interest.","There are many potential causes of fever, shivering, and body pain. Some common causes include:

Infections: Infections, such as the flu or pneumonia, can cause fever, shivering, and body aches.

Immunological disorders: Certain immune disorders, such as autoimmune diseases, can cause fever and body aches.

Inflammatory conditions: Inflammatory conditions, such as rheumatoid arthritis or lupus, can cause fever, body aches, and joint pain.

Cancer: In some cases, cancer can cause fever, shivering, and body pain.

It is important to see a doctor to determine the cause of your wife's symptoms and receive proper treatment. In the meantime, you can try to reduce the fever by giving her acetaminophen (Tylenol) or ibuprofen (Advil) and encouraging her to rest and drink plenty of fluids.",0,0,False,False,180,301,0.9163361837561517,0.10810810810810811,0.039614546235621245,4c1cbef644e5ad6a64c2209098c975c58e5f80d93e25f5c5f9f23ad14f6049fe_LIME_Explainer_DetectorDetectGPT,0e65e1bbbf8133d14e940529817a55398d439910f1376e70272bb3a6fca25e02_LIME_Explainer_DetectorDetectGPT
10,DetectorDetectGPT,LIME_Explainer,"Yes, buying REITs (Real Estate Investment Trusts) can be compared to investing in real estate. REITs are companies that own or finance income-generating real estate, such as apartments, shopping centers, office buildings, and warehouses. They are required to distribute at least 90% of their taxable income to shareholders in the form of dividends, which can make them a good source of passive income. When you buy shares in a REIT, you are essentially investing in a diversified portfolio of real estate assets. Just like with any investment, there are risks involved, including the risk that the value of the REIT's assets may decline or that the REIT may not generate sufficient income to pay dividends to shareholders. It's important to carefully consider these and other risks before making any investment decisions.","Investing in stocks can be a good idea if you are able to accept the risks that come with it. Stocks can offer the potential for high returns, but they can also fluctuate in value, and you could lose money. Before you invest in stocks, it's important to do your research and understand the basics of the stock market. It's also important to have a long-term perspective and a diversified portfolio, which means investing in a variety of different stocks and asset classes rather than putting all of your money into one type of investment. It's also a good idea to consult with a financial advisor or professional before making any investment decisions.",0,0,False,False,2,196,0.9637691467302009,0.2152777777777778,0.23438292588659448,398430643258bb00cedee78053fb66f240d53d21b390dcd511c861b3649bea5c_LIME_Explainer_DetectorDetectGPT,f022d78aadca7c71859f5ac0face8af6733d02c0e59b3731b90b918cd9eaae83_LIME_Explainer_DetectorDetectGPT
11,DetectorDetectGPT,LIME_Explainer,"Medical image analysis is the process of analyzing medical images to extract information that can be used to make diagnostic or therapeutic decisions. Medical images are used in a variety of medical contexts, including radiology, pathology, and cardiology, and they may be in the form of x-rays, CT scans, MRIs, or other types of images.



Medical image analysis involves a number of different techniques and approaches, including image processing, computer vision, machine learning, and data mining. These techniques can be used to extract features from medical images, classify abnormalities, and visualize data in a way that is useful to medical professionals.



Medical image analysis has a wide range of applications, including diagnosis and treatment planning, disease monitoring, and surgery guidance. It can also be used to analyze population-level data to identify trends and patterns that may be useful for public health or research purposes.","It is important to get the lump on your grandson's temple checked out by a healthcare provider. It is possible that it could be a mosquito bite, a tick bite, or a spider bite, but it could also be something else. It is always better to have a healthcare provider assess any lumps or bumps on the body to determine the cause and appropriate treatment.

In the meantime, you can try to keep the area clean and dry, and you can apply a cool compress to the area to help reduce swelling and discomfort. If your grandson experiences any other symptoms, such as fever, dizziness, or difficulty breathing, you should seek medical attention right away.",0,0,False,False,66,216,0.8962717472186539,0.1032258064516129,0.10573066072208837,b8575699866202360098f33a9c4a5c7efaceec2561eb4ee95acf02da992aab65_LIME_Explainer_DetectorDetectGPT,739372dc4bf92366bc991aab94a8f80ee06f90e30c51cd5c4bc286de0dec2016_LIME_Explainer_DetectorDetectGPT
12,DetectorDetectGPT,SHAP_Explainer,"If your counterparty sent money to a correspondent account at another bank, then it is completely up to the other bank what to do with the money. If the wire transfer completed, then the account is not closed. If I were your business partner, I would immediately contact the bank to which the transfer was made and explain the situation and hopefully they will transfer the money back. Whenever a wire transfer is made, the recipients name, address, and account number are included. If that name, address and account do not belong to you, then you have a problem because you have no legal right to the money in a court of law. For this reason, you should be avoid any situation where you are wiring money to anyone except the intended recipient.","As your is a very specific case, please get an advice of CA. It should not cost you much and make it easier. The sale of agriculture land is taxable in certain conditions and exempt from tax in other cases. Sale of agricultural land is subject to capital gains tax. But there are certain exemptions under Section 54B, subject to conditions, which are as follows:    If deemed taxable, you can avail indexation, ie the price at which you grandfather got [the date when he inherited it as per indexation] and pay 10% on the difference. If the price is not known, you can take the govt prescribed rate.   As there is a large deposit in your fathers account, there can be tax queries and need to be answered. Technically there is no tax liable even if your grandfather gifts the money to your father. More details at http://www.telegraphindia.com/1130401/jsp/business/story_16733007.jsp and http://www.incometaxindia.gov.in/publications/4_compute_your_capital_gains/chapter2.asp",1,1,True,True,22,82,0.9495923622857968,0.14285714285714285,0.15388841713317383,3dd1514de75255da157c91f80bf9745485cc700f81cf40cf3751d17e5d391a60_SHAP_Explainer_DetectorDetectGPT,6b25114906789fc86fa719f0394277f9289f080cbbbc7ef1abbdd038f00db4b6_SHAP_Explainer_DetectorDetectGPT
13,DetectorDetectGPT,SHAP_Explainer,"It doesn't generally matter, and I'm not sure if it is in fact in use by the IRS other than for general statistics (like ""this year 20% of MFJ returns were with one spouse being a 'homemaker'""). They may be able to try and match the occupation and the general levels and types of income, but for self-employed there's a more precise and reliable field on Schedule C and for employees they don't really need to do this since everything is reported on W2 anyway. So I don't think they even bother or give a lot of value to such a metric. So yes, I'm joining the non-authoritative ""doesn't matter"" crowd.","Most likely because they don't know what they're talking about. They all have a belief without evidence that information set X is internalised into the price but information set Y is not. If there is some stock characteristic, call it y, that belongs to set Y, then that moves the gauge towards a ""buy"" recommendation. However, the issue is that no evidence has been used to determine the constituents of X and Y, or even whether Y exists in any non-trivial sense.",1,1,True,True,40,93,0.9569201663799602,0.15602836879432624,0.11947996577921892,5ae5387b74d5d39364702c87dfff6d52121b249c4e7e6b28e9d3684e67481016_SHAP_Explainer_DetectorDetectGPT,bd8409f3f1639cee9358cc358d6fcedf58657cd4e17ac73a2c395bb9acd91f62_SHAP_Explainer_DetectorDetectGPT
14,DetectorDetectGPT,SHAP_Explainer,"I agree, one should not let the tax tail wag the investing dog.  The only question should be whether he'd buy the stock at today's price. If he wishes to own it long term, he keeps it. To take the loss this year, he'd have to sell soon, and can't buy it back for 30 days. If, for whatever reason, the stock comes back a bit, he's going to buy in higher.  To be clear, the story changes for ETFs or mutual funds. You can buy a fund to replace one you're selling, capture the loss, and easily not run afoul of wash sale rules.","The UK has historically aggressive financial law, inherited from Dutch friendship, influence, and acquisitions by conquest. The law is so open that nearly anyone can invest through the UK without much difficulty, and citizens have nearly no restrictions on where to invest. A UK citizen can either open an account in the US with paperwork hassles or at home with access to all world markets and less paperwork.  Here is the UK version of my broker, Interactive Brokers.  Their costs are the lowest, but you will be charged a minimum fee if you do not trade enough, and their minimum opening balance can be prohibitively high for some. If you do buy US products, be sure to file your W-8BEN.",1,1,True,True,164,237,0.9151774859614302,0.1282051282051282,0.09483123402778632,2c05fd1a84cc8d7fedd6bed6fba06a00a6a7c0997fec7ff7691a98907eb330e9_SHAP_Explainer_DetectorDetectGPT,8f1e6fbc370ec179204b1bddc3deb954e294f8e3c4e61c39cb9a8962682e7816_SHAP_Explainer_DetectorDetectGPT
