,Detector,Explainer,Documents Phases 1+3,Documents Phases 2+4,f(a),f(b),GT a,GT b,idx a,idx b,Spacy Similarity,Jaccard Similarity,Cosine Similarity tfidf,hash a,hash b
29,DetectorRadford,LIME_Explainer,"Credit unions are not-for-profit financial cooperatives that are owned and controlled by their members. In order to join a credit union, an individual must meet the credit union's membership requirements, which may include living or working in a certain area, being affiliated with a certain organization, or meeting other eligibility requirements. Credit unions are typically open to anyone who meets these requirements and is willing to become a member.However, it is worth noting that not all credit unions have the same membership requirements, and some credit unions may have more restrictive eligibility requirements than others. Some credit unions may be open only to members of a specific organization or group, such as a union or employer, while others may be open to anyone who lives or works in a particular region. It is important to check the specific membership requirements of a credit union before attempting to join.","Gordon Bell is a computer scientist and electrical engineer who has made significant contributions to the field of computer architecture and digital hardware design. He is best known for his work on the VAX computer system and for the development of the SPEC benchmarks, which are used to measure the performance of computer systems. Bell has also played a major role in the development of the field of high-performance computing, and has received numerous awards and honors for his work, including the IEEE Computer Society's Computer Pioneer Award and the ACM SIGARCH Maurice Wilkes Award. He is currently a researcher at Microsoft Research and a professor emeritus at Carnegie Mellon University.",0,0,False,False,161,204,0.8654329923962544,0.1,0.035942069096041446,51d1e47a3a3e56608b1fbc9a3f63dfd38a5d07ecd938376e90689070b826a166_LIME_Explainer_DetectorRadford,49afdd008b7667f8c575f34ad378723e39feb10666c2e923c3fe76e083704854_LIME_Explainer_DetectorRadford
30,DetectorRadford,SHAP_Explainer,"Predictive analytics encompasses a variety of statistical techniques from data mining, predictive modeling, and machine learning that analyze current and historical facts to make predictions about future or otherwise unknown events.
In business, predictive models exploit patterns found in historical and transactional data to identify risks and opportunities. Models capture relationships among many factors to allow assessment of risk or potential associated with a particular set of conditions, guiding decision-making for candidate transactions.
The defining functional effect of these technical approaches is that predictive analytics provides a predictive score (probability) for each individual (customer, employee, healthcare patient, product SKU, vehicle, component, machine, or other organizational unit) in order to determine, inform, or influence organizational processes that pertain across large numbers of individuals, such as in marketing, credit risk assessment, fraud detection, manufacturing, healthcare, and government operations including law enforcement.","Human intelligence is the intellectual capability of humans, which is marked by complex cognitive feats and high levels of motivation and self-awareness. High intelligence is associated with better outcomes in life.
Through intelligence, humans possess the cognitive abilities to learn, form concepts, understand, apply logic and reason, including the capacities to recognize patterns, plan, innovate, solve problems, make decisions, retain information, and use language to communicate. There are conflicting ideas about how intelligence is measured, ranging from the idea that intelligence is fixed upon birth, or that it is malleable and can change depending on an individual's mindset and efforts. Several subcategories of intelligence, such as emotional intelligence or social intelligence, are heavily debated as to whether they are traditional forms of intelligence. They are generally thought to be distinct processes that occur, though there is speculation that they tie into traditional intelligence more than previously suspected.",1,1,True,True,6,247,0.9554576980061745,0.10837438423645321,0.06509843577186564,42b84c175e792cbace8c18218652b0e5fc172d0722913d506f6ee3be1091a6f6_SHAP_Explainer_DetectorRadford,936af4095ba223d41fa40efae657dfe1169abfac77176d592e017e841f00de29_SHAP_Explainer_DetectorRadford
31,DetectorRadford,SHAP_Explainer,"As your is a very specific case, please get an advice of CA. It should not cost you much and make it easier. The sale of agriculture land is taxable in certain conditions and exempt from tax in other cases. Sale of agricultural land is subject to capital gains tax. But there are certain exemptions under Section 54B, subject to conditions, which are as follows:    If deemed taxable, you can avail indexation, ie the price at which you grandfather got [the date when he inherited it as per indexation] and pay 10% on the difference. If the price is not known, you can take the govt prescribed rate.   As there is a large deposit in your fathers account, there can be tax queries and need to be answered. Technically there is no tax liable even if your grandfather gifts the money to your father. More details at http://www.telegraphindia.com/1130401/jsp/business/story_16733007.jsp and http://www.incometaxindia.gov.in/publications/4_compute_your_capital_gains/chapter2.asp","Assuming you live in the US, it is quite normal when you are applying for a loan that the application will ask you to confirm your identity. One of these methods is to ask you which of the following addresses you have lived at, with some of them being very similar (i.e. same city, or maybe even the same street). Sometimes they will ask questions and your answer would be ""None of the above."" This is done to prevent fraudsters from applying for a loan under your identity. If you see no signs of unauthorized accounts or activities on your credit reports, and you initiated the car loan application, then you should be fine.",1,1,True,True,82,238,0.965907453019884,0.15432098765432098,0.1423502783969935,6b25114906789fc86fa719f0394277f9289f080cbbbc7ef1abbdd038f00db4b6_SHAP_Explainer_DetectorRadford,60b992dfcad293c2fbe76d7842a4e469ba041ced7c527062e4be34058e2d9d44_SHAP_Explainer_DetectorRadford
32,DetectorRadford,SHAP_Explainer,"Alonzo Church (June 14, 1903 – August 11, 1995) was an American mathematician, computer scientist, logician, philosopher, professor and editor who made major contributions to mathematical logic and the foundations of theoretical computer science. He is best known for the lambda calculus, the Church–Turing thesis, proving the unsolvability of the Entscheidungsproblem, the Frege–Church ontology, and the Church–Rosser theorem. He also worked on philosophy of language (see e.g. Church 1970). Alongside his student Alan Turing, Church is considered one of the founders of computer science.","Sir Charles Antony Richard Hoare (Tony Hoare or C. A. R. Hoare) FRS FREng (born 11 January 1934) is a British computer scientist who has made foundational contributions to programming languages, algorithms, operating systems, formal verification, and concurrent computing. His work earned him the Turing Award, usually regarded as the highest distinction in computer science, in 1980.
Hoare developed the sorting algorithm quicksort in 1959–1960. He developed Hoare logic, an axiomatic basis for verifying program correctness. In the semantics of concurrency, he introduced the formal language communicating sequential processes (CSP) to specify the interactions of concurrent processes, and along with Edsger Dijkstra, formulated the dining philosophers problem.[10][11][12] He is also credited with development (and later criticism) of the null pointer, having introduced it in the ALGOL family of languages. Since 1977, he has held positions at the University of Oxford and Microsoft Research in Cambridge.",1,1,True,True,140,269,0.971316904524595,0.14556962025316456,0.16687650480081972,652189ac593cc7b3afcb7e0bd1c48f5b8209e21ca515947d7c216869dd2e9185_SHAP_Explainer_DetectorRadford,0d824782624b2690ac2bde813a1cf6a7df527e243a4875e309d56a6cb04116f6_SHAP_Explainer_DetectorRadford
33,DetectorRadford,SHAP_Explainer,"It is possible that your son is experiencing an allergic reaction to the capsicum and paneer. Allergic reactions can vary in severity and may involve symptoms such as throat pain, coughing, difficulty swallowing, and difficulty breathing. The symptoms may improve with treatment, but they may also recur if exposure to the allergen continues.

If your son is experiencing recurrent allergic reactions after eating capsicum and paneer, it is important to avoid these foods in the future to prevent further allergic reactions. You may also want to consider discussing your son's symptoms with an allergist or immunologist, who can perform allergy testing to determine which specific substances are causing the allergic reactions and help develop a plan to manage the allergies. In the meantime, it is important to follow your doctor's instructions for treating the allergic reactions and to seek medical attention if the symptoms worsen or do not improve.","There are many potential causes of fever, shivering, and body pain. Some common causes include:

Infections: Infections, such as the flu or pneumonia, can cause fever, shivering, and body aches.

Immunological disorders: Certain immune disorders, such as autoimmune diseases, can cause fever and body aches.

Inflammatory conditions: Inflammatory conditions, such as rheumatoid arthritis or lupus, can cause fever, body aches, and joint pain.

Cancer: In some cases, cancer can cause fever, shivering, and body pain.

It is important to see a doctor to determine the cause of your wife's symptoms and receive proper treatment. In the meantime, you can try to reduce the fever by giving her acetaminophen (Tylenol) or ibuprofen (Advil) and encouraging her to rest and drink plenty of fluids.",0,0,False,False,170,301,0.9192424598506673,0.16,0.0894710344591062,53bb29915fb86c3bd323ddf3342af288e3110b3d8c470c1eb5f42394840efd58_SHAP_Explainer_DetectorRadford,0e65e1bbbf8133d14e940529817a55398d439910f1376e70272bb3a6fca25e02_SHAP_Explainer_DetectorRadford
34,DetectorRadford,SHAP_Explainer,"Ex Machina is a 2014 science fiction film written and directed by Alex Garland in his directorial debut. There are four significant characters, played by Domhnall Gleeson, Alicia Vikander, Sonoya Mizuno, and Oscar Isaac. In the film, programmer Caleb Smith (Gleeson) is invited by his CEO (Isaac) to administer the Turing test to an intelligent humanoid robot (Vikander).
Made on a budget of $15 million, Ex Machina grossed $36 million worldwide. It received acclaim, with praise for its leading performances, the screenplay, the visual effects, and the editing. The film was nominated for two awards at the 88th Academy Awards, winning Best Visual Effects, and received numerous other accolades.","Yes, an individual share of stock has a unique identifier, which is known as a ticker symbol. A ticker symbol is a series of letters that represents a specific publicly traded company's stock. It is used to identify the company's stock on exchanges and other financial platforms. For example, the ticker symbol for Apple Inc. is ""AAPL,"" and the ticker symbol for Microsoft Corporation is ""MSFT."" When you purchase a share of stock, you will receive a certificate that lists the ticker symbol for the company, along with other information about the stock, such as the number of shares you own and the price at which you purchased the shares.",0,0,True,False,131,138,0.8203645272224697,0.1048951048951049,0.05150963373078507,9c2819093af7132a0a8561724a8df7917529cfc64b2f8c662f6ba7fbdba167f6_SHAP_Explainer_DetectorRadford,e755f987a374165af6f73c08941038e34ee0062bf016af95765ec779f8e910b7_SHAP_Explainer_DetectorRadford
35,DetectorRadford,SHAP_Explainer,"If your deductions are higher than your income, it is possible that you may not owe any taxes. This can happen if you have a loss for the tax year, which can be calculated by subtracting your deductions from your income. If the result is a negative number, then you have a loss for the tax year.However, it's important to note that losses from some types of income, such as wages, salaries, and self-employment income, may be limited in the amount that can be claimed on your tax return. Additionally, you may be able to carry over any excess loss to future tax years and use it to offset income in those years.It's a good idea to consult with a tax professional or refer to the Internal Revenue Service (IRS) guidelines to determine how to properly report and claim losses on your tax return.","If you are experiencing abdominal pain and bloating, especially if it is severe or accompanied by other symptoms such as fever, vomiting, or diarrhea, it is important to seek medical attention as soon as possible. Appendicitis is a potentially serious condition that requires prompt treatment, and the symptoms you have described could be indicative of appendicitis or another serious condition.

If you are unable to reach your doctor or do not have one, it is advisable to go to the nearest emergency department or urgent care center for evaluation and treatment. Do not hesitate to seek medical attention, especially if you are experiencing severe or worsening symptoms. It is better to be safe and get checked out by a medical professional rather than risk worsening your condition.",0,0,False,False,77,177,0.9450307624043468,0.1917808219178082,0.13489318139200004,4a28a8f0d8c6fbee4a7aad31697d315f2e4782776460940f74505a777beeea7e_SHAP_Explainer_DetectorRadford,642deaeddd2290674c7e87199e3d35b5a1720219827bef647d8795d795148aba_SHAP_Explainer_DetectorRadford
36,DetectorGuo,Anchor_Explainer,"Hello, Thanks for your query.This can occur due to constipation and the white thing could have a protective mucus coating. The contraction of the large bowel to expel this can give you the pain. There can be an internal problem like an ulcer or a mass contributing to this. If you continue to get the same problems, it will be better to consult an Gastro and for further investigations like colonoscopy to rule out an internal problem.I do hope that you have found something helpful and I will be glad to answer any further query.Take care","thanks for your query, the bump could be secondary to the impact or any nasal bone fracture. consult your oral physician and get radiographs done to rule out fracture. you can take antiinflammatory drugs to reduce the swelling but cause has to be ruled out. i hope my answer will help you take care",1,1,True,True,163,175,0.962259057047494,0.23655913978494625,0.2555730070710987,797c3e2456febfd1031497754c2da79b9b0cb00f770118509209354664a94d17_Anchor_Explainer_DetectorGuo,b2ae8a1624e51a0894124a9aaae1fb99c3557b284a96c7338d464111e90d3425_Anchor_Explainer_DetectorGuo
37,DetectorGuo,Anchor_Explainer,"Use VTIVX. The ""Target Retirement 2045"" and ""Target Retirement 2045 Trust Plus"" are the same underlying fund, but the latter is offered through employers.  The only differences I see are the expense ratio and the minimum investment dollars.  But for the purposes of comparing funds, it should be pretty close. Here is the list of all of Vanguard's target retirement funds. Also, note that the ""Trust Plus"" hasn't been around as long, so you don't see the returns beyond the last few years.  That's another reason to use plain VTIVX for comparison. See also: Why doesn't a mutual fund in my 401(k) have a ticker symbol?","they apply it to my next payment That's what my bank did with my auto loan.  I got so far ahead that once I was able to skip a payment and use the money I would have sent the bank that month for something else.  Still, though, I kept on paying extra, and eventually it was paid off faster than ""normal"". EDIT:  what does your loan agreement say is supposed to happen to extra payments?",1,1,True,True,5,50,0.8444693728625342,0.16666666666666666,0.0669863989130398,7f8cd548cf57f327155b067b8fbdbfc3b124bea38e84e54e6d33d2cb0d9b3505_Anchor_Explainer_DetectorGuo,f3372df44a7f627dbf381c0e0732206e97b01b859f51726fce8f34dc5f51e113_Anchor_Explainer_DetectorGuo
38,DetectorGuo,Anchor_Explainer,"I've heard of handyman type people making a living this way untaxed.  They move into a fixer-upper, fix it up while living there, stay over two years and sell.  They can pocket $125k/yr tax free this way assuming they produce that much value in their fixing-up.  (Beware, though, that this will bite you in low social security payments in retirement!)","Both are saying essentially the same thing.  The Forbes articles says ""as much as 20% [...] up to a maximum of $50,000"".  This means the same as what the IRS page when it says the lesser of a percentage of your income or a total of $53,000.  In other words, the $53k is a cap: you can contribute a percentage of your earnings, but you can never contribute more than $53k, even if you make so much money that 20% of your earnings would be more than that. (The difference between 20% and 25% in the two sources appears to reflect a difference in contribution limits depending on whether you are making contributions for employees, or for yourself as a self-employed individual; see Publication 560.  The difference between $50k and $53k is due to the two pages being written in different years; the limits increase each year.)",1,1,True,True,0,52,0.8874951075616169,0.13513513513513514,0.0909054275804122,6a66e7a115420485acd54c0cb9e5dc4e9e508b29af4b544aee8ec3f9adfaf7ac_Anchor_Explainer_DetectorGuo,714b04dd8923e09ea3f370b93660441d792104140d13d38c697abcbe465d0e10_Anchor_Explainer_DetectorGuo
39,DetectorGuo,Anchor_Explainer,"It's not appropriate for me to provide specific medical advice or to comment on the treatment plan that your doctor has prescribed for you without knowing more about your individual case and medical history. It's important to follow the treatment plan recommended by your doctor, as they are the most qualified to provide you with the appropriate care. If you have any concerns about your treatment plan, it's important to discuss them with your doctor. They will be able to provide you with more information and help address any questions or concerns you may have.","It is important to note that alternative medicine, such as homeopathy and ayurveda, should not be used as a replacement for conventional medical treatment for esophagus disorders. It is important to consult with a medical professional and follow their recommended treatment plan.

That being said, some people with esophagus disorders may find relief from symptoms with the use of alternative medicine in addition to conventional treatment. If you are interested in exploring the use of alternative medicine, it is important to discuss this with your doctor and make sure that it is safe and appropriate for your specific condition.

It is also important to note that the effectiveness of alternative medicine for esophagus disorders has not been widely studied and there is limited scientific evidence to support its use. Therefore, it is important to be cautious and to carefully consider the potential risks and benefits before trying any alternative treatments.",0,0,False,False,64,283,0.9498289432202853,0.25210084033613445,0.2532659713703468,1c35a009e503d36bb2c4626ddfba2ae6b24be70146daec612eda12a884ba5bab_Anchor_Explainer_DetectorGuo,84534927d51051602ae5f88b2ae19eb988ea070fa35837ba68b9b85abef414e0_Anchor_Explainer_DetectorGuo
40,DetectorGuo,Anchor_Explainer,"It is important to seek medical attention for sudden onset abdominal pain and vomiting. The specific treatment will depend on the underlying cause of the symptoms.

Possible causes of left lower quadrant pain and vomiting include gastrointestinal issues such as bowel obstruction, diverticulitis, or gastroenteritis, as well as other conditions such as urinary tract infection or ovarian cysts.

Initial treatment may involve managing pain with medications, as well as replacing fluids and electrolytes lost due to vomiting. Depending on the cause, further treatment may be necessary, such as antibiotics for an infection or surgery to remove a blockage.

It is important for the individual to see a healthcare provider for proper diagnosis and treatment. The provider will ask about the individual's medical history, perform a physical examination, and may order tests such as blood work, a CT scan, or X-ray to help determine the cause of the symptoms.","It is possible that the pain and other symptoms you are experiencing could be related to anxiety. Stress and anxiety can cause physical symptoms such as chest pain, rapid heartbeat, and muscle tension. However, it is also important to consider the possibility that these symptoms could be caused by other factors, such as an underlying health condition. It is always a good idea to have any new or unusual symptoms checked out by a healthcare professional to determine the cause and ensure that you receive proper treatment. If you are concerned about your symptoms, I would recommend speaking with a healthcare provider for a proper evaluation. They can help determine the cause of your symptoms and recommend appropriate treatment.",0,0,False,False,122,296,0.9546641082907914,0.20833333333333334,0.3286896845755025,08a7b4e29d115abac42856432e00f2d1948de7c9c99a7227c5ec191c62856cc7_Anchor_Explainer_DetectorGuo,b3ec68c74de53fc0c6fe8729beb8ae1840ff888e169d559297ce3addd5b59a7e_Anchor_Explainer_DetectorGuo
41,DetectorGuo,Anchor_Explainer,"The opposite of a hedge is a speculative position. A hedge is a financial instrument that is used to reduce the risk of potential loss from price movements in an asset. It is a way to protect against potential losses in an investment. A speculative position, on the other hand, is one in which an investor is taking on more risk in the hopes of realizing a larger potential gain.","There are many stocks that may have only had one significant peak or increase in price. These types of stocks are often referred to as ""one-hit wonders"" or ""flash in the pan"" stocks. These stocks may have experienced a sudden surge in price due to a variety of factors, such as a new product or service launch, a positive earnings report, or a change in market conditions. However, these stocks may also be more prone to volatility and may not have a consistent track record of performance. It's important to thoroughly research and assess the risks and potential rewards of any stock before investing in it.",0,0,False,False,35,210,0.9129957881562721,0.11926605504587157,0.10741265970950603,4821b7b7fc212de2c8264769259f2dd8d8914003e2f1e8fb3a2d923935ac4621_Anchor_Explainer_DetectorGuo,ff797fc8902be0f317e8a27ce16d17883ef5f2b97d50b52482a402a7d44512d1_Anchor_Explainer_DetectorGuo
42,DetectorGuo,LIME_Explainer,Hello dearWarm  welcome to Healthcaremagic.comI have evaluated your query thoroughly .*  This is in relation with different  issues as    -  dehydration following polyuria  from alcoholism  -  in consumption with    possible intake  of  spices  with  alcohol  -  psychosomatic  manifestation    of  underlying  stress or  anxiety  -  others Hope this clears your doubt  .Wishing you fine recovery .Welcome for any further  assistance .Regards dear take care .,"Thanks for your question on Healthcare Magic. I can understand your concern. Yes, these symptoms can be due to anxiety. But better to rule arrhythmia (rhythm disturbances in heart) because it can also cause chest pain, faster heart beats etc. So consult doctor and get done ecg, 2d echo and Holter monitoring (24 hours continuous recording of ecg). If all these are normal then no need to worry for arrhythmia or other heart diseases. Stress and anxiety can also cause similar symptoms. So consult psychiatrist and get done counselling sessions . Try to identify stressor in your life and start working on it's solution. You may need anxiolytic drugs too. Avoid stress and tension, be relax and calm. Don't worry, you will be alright, but first rule out heart diseases. Hope I have solved your query. I will be happy to help you further. Wish you good health. Thanks.",1,1,True,True,129,194,0.8719720772570635,0.09271523178807947,0.09371979423954745,e5e2abf2af1e944f04c8c9d000f7dbf4e66c4d234f83a992d4a98f1a81e21099_LIME_Explainer_DetectorGuo,47e9700fa53a47fb40d1025a89aec77680c41248c82119e28dac3a411a01b6b3_LIME_Explainer_DetectorGuo
